company_rank,company,company_total_score,liatrio_service_area,headline,source,url,published,relevance_score,matched_keywords,outreach_angle
4,Leidos,10.5,Digital Transformation,Leidos wins State Department IT modernization work (LDOS:NYSE) - Seeking Alpha,Seeking Alpha,https://news.google.com/rss/articles/CBMikgFBVV95cUxOYTR3WVdYMC0wNGhtenpjd1dkTDdjWGhZTmJQRUVOa1VpV2tXbUlRSV8zenM1VnJlTHgwb1pId25RSTVMNGpKU2lSc3p5bXdZQWRmYTJqVktFR01ZZWpYQ3RTa0JWZGpGVFh0Vmk0VU5fQWRwUGlPVjVMYWJHQl8yQ1Q3eExjZjVTd2Q4RkJOLVMyZw?oc=5,"Thu, 21 May 2026 20:02:01 GMT",1,IT modernization,"Liatrio drives holistic transformation across people, process, and technology. Reference the leadership change and offer a strategy session."
5,General Electric,10.0,Digital Transformation,Digital Transformation of Energy Accelerating GE's Digital Plans for Power Industry - General Electric,General Electric,https://news.google.com/rss/articles/CBMitAFBVV95cUxON2NmNW9lSVNhd1ZiSEtQM3IycGJtdWxGQW9FNnVaOHhGTnNIZnpBR0NjcHdXOEpsWGtqeFUwczRkbUQ3elZZUmZkdHJTejhPR3I4c25TN21vWVBsRWswQ2ZHRDdEZUJ0TGs1cGdVUi0zQ0laX2VWZkVBT09JSzNxNGxIZ0RTMTRRNnpBOEg5Mlh1cUxPUkZFNHlrcVBWV21XT1RNVDFPM25YUkphLWdQZVNtTmk?oc=5,"Wed, 24 Feb 2016 08:00:00 GMT",1.5,digital transformation,"Liatrio drives holistic transformation across people, process, and technology. Reference the leadership change and offer a strategy session."
5,General Electric,10.0,Digital Transformation,Royal Jordanian embraces digital transformation with GE Aerospace flight operations software suite - GE Aerospace,GE Aerospace,https://news.google.com/rss/articles/CBMixAFBVV95cUxOcmMxeHNPT0J2eGU0Y2ZKSWRJNWlySXRMbzctcEpKQW9US01UVjdnd2ZHTHRxQ3RoYUJFM0g4YzQ5YmFRQ1pJd3dVTmNMX1pQUWNOR0lPVEJpN0xUWHlfTUJoUHZBRWtGXy0tUW1tMkFmWGt3Mm9NWTRTYkZ1ZWFRQ1IwZVFLVXpMeWhtcUluaURSV0x3b1o5a2RldDRKMnJISVlHeEo2N2R4Zk5HcWJYOFFMYU9FamVKR0VnX2FhVVBKYldq?oc=5,"Tue, 08 Apr 2025 07:00:00 GMT",1.5,digital transformation,"Liatrio drives holistic transformation across people, process, and technology. Reference the leadership change and offer a strategy session."
5,General Electric,10.0,Application Modernization,Accelerate Operations Technology Data Insights with GE’s Cloud-Native Proficy Historian - Amazon Web Services (AWS),Amazon Web Services (AWS),https://news.google.com/rss/articles/CBMiuwFBVV95cUxNUXU1MTFfbGJYTU51SVR2NGtfSWx3NDdteS1uOEdJODBoa2xuSkszaHJLLXBFUTZGSmM1NERCenNhNFB3NENqN2trNTN0QTdhM0hBRU1fNDlIWkhPRFBPQTFCcExyajdNQUpLNGd0Z2x0V1pzbnl4dW0zd0RoX0xHcXBSbFVrdmQ1N25hVF9MZ1UwRGp0MHZlQWdZWkt4NkVOajA3YkNmSEZhWndGeHpHQVlCcjRUUmoyNHZZ?oc=5,"Wed, 20 Sep 2023 07:00:00 GMT",1,cloud-native,"Liatrio turns legacy apps into cloud-native, AI-ready software. Offer a modernization roadmap."
5,General Electric,10.0,DevOps & Platform Engineering,Red Hat’s OpenShift 4 Kubernetes Platform: 5 Things To Know - crn.com,crn.com,https://news.google.com/rss/articles/CBMilgFBVV95cUxNam5mTFBIcDl4bzlicGhETUVxdWdVNFIxeXJYVnBsX2lyV1kzbG9MWmNacHlPMjRMUWVyYW40S3lUME5QeFdPUDk0ZS1iQXZiSm9RQzhKZnVKN3o0b1NSbGdTUzIyRTZad2hnZHpJWEVveW9OQWwxOHl6bFY5czJqd1ZtZGlCVG14R3hGNFZmR082R3dNT3c?oc=5,"Fri, 10 May 2019 07:00:00 GMT",1,Kubernetes,Liatrio builds internal developer platforms that accelerate delivery. Offer a DevOps maturity assessment.
5,General Electric,10.0,Application Modernization,Kong raises $100M for its cloud-native application connectivity platform - SiliconANGLE,SiliconANGLE,https://news.google.com/rss/articles/CBMiogFBVV95cUxOc1p5SDZadk5TNlJlUkJuTF96WVpMMnNaLVhLN3JZb0NXR0tHOU5BWVNCVTk5UTZsbE5jTmRVWjFfaVRSYTFZYUdiR19tSnI4c0hQbTlrYTdRREkyWUNnWHNmVHZOOGxnbC1iTjRBSENJaExja05wZUJkb3BLSHBqWkZIa3JRSDZXNnNVczE0VWFFOE5Gcm5oc1RuSzN2Rllxcmc?oc=5,"Mon, 08 Feb 2021 08:00:00 GMT",1,cloud-native,"Liatrio turns legacy apps into cloud-native, AI-ready software. Offer a modernization roadmap."
5,General Electric,10.0,Security & Compliance,Zscaler Appoints Sunil Frida as Chief Marketing Officer to Accelerate Growth in Zero Trust and AI Security Market - Quiver Quantitative,Quiver Quantitative,https://news.google.com/rss/articles/CBMi3wFBVV95cUxQSmlNZlZqOU45Z1RlR2x5a09QbXc2STZJcWRIbGhlZUVvUVZsaUtjZllTYVNlNUdJc2VwQ2ZLQjhjU293ZkV3SEdsYUx1ZEUwVDUzazIxMmJYaEtJRDYxaDlkaEdTaWVzdDhuSDZldUdPSkVsZXdmVGplLW1KWVVHTzJuVjQtYUdZRUVseVBzQmlCNFJ2YTJRWUdkQVc4UEdqcGRubkpKZ01yR2pLeFZkVTEtQnZPRjJhcVVHb3l6dHVHNlo2NDBtNVRSN3diNV9zYS00cTE5WFl6anNQNmdj?oc=5,"Mon, 05 Jan 2026 08:00:00 GMT",1,zero trust,Liatrio integrates security into the software delivery pipeline. Offer a DevSecOps assessment.
5,General Electric,10.0,Digital Transformation,General Electric – Digital Transformation Strategies - Global Data,Global Data,https://news.google.com/rss/articles/CBMiigFBVV95cUxQb1hyZXl0a0FPNlo3T3ZJcG1jV2NMdWlGczBYekUxRHpJMVZLaDdNVzRlTDRTNVZoemdXcEdmVjJzZHQtbUhzeGRIakpKejJEdmo3Z1ItQmd5ZW11R1dia2FsY1oyUmE2aVhpUVF3YTdCZ0x2dFBWb2w3b2NUNTNvZkZmUVNmWFZsdFE?oc=5,"Tue, 29 Oct 2024 07:00:00 GMT",1,digital transformation,"Liatrio drives holistic transformation across people, process, and technology. Reference the leadership change and offer a strategy session."
5,General Electric,10.0,Digital Transformation,Lessons learned from GE's Digital Transformation Failure - Intelligent Automation Network,Intelligent Automation Network,https://news.google.com/rss/articles/CBMiuAFBVV95cUxPRVBidzlIUnhZWWdzRTBRRS1kbVQzQWhMb3EwTDZLVmZQVEYwdEhEUkg3NTRuTGIxUUExWVhHcWY4cGtyUXQ5X0xycm9TbWhoY3VlcUtOd3d5Qml0WE11bjByZzdMM0JaNEZmODF6QmJad21HeGUzT0ppaEhSYjUweW1wN1VNRGhwSmE2bmRxalF1bHZGQkdzQWhpRmNPMWVLUGNVaGdIWHlhZnhYaFRBVnBtbTBsNkFv?oc=5,"Tue, 08 Mar 2022 08:00:00 GMT",1,digital transformation,"Liatrio drives holistic transformation across people, process, and technology. Reference the leadership change and offer a strategy session."
5,General Electric,10.0,Digital Transformation,Digital Transformation At Scale At General Electric: Digital Influencer Bill Ruh - Forbes,Forbes,https://news.google.com/rss/articles/CBMi0AFBVV95cUxPaHNiRzFQNFBwaFZ0bHpFSzE1R21Ydm5VQjdZTWctSzhuWWgxU240LU80cktXZ0J0U19qbHp3LWlOUkEybm1aY2o5Y3RVcGVGLTBlM2o0U3k3YWZWdFgtRFZPM3R4RW1LOFpFaUtnSndsT0QyOGdKYkl6azh1U0txRWliU09EZzZhYjliNnBhTnExSHNUV3p1bk9sQkZpRDZ0c0Vxd1FCTk96MGhzMlM4MGhrOGVZd0l3N2ZSQTF1U2J3cUVOR3FibXM4S3Ftb1Vi?oc=5,"Mon, 25 Jul 2016 07:00:00 GMT",1,digital transformation,"Liatrio drives holistic transformation across people, process, and technology. Reference the leadership change and offer a strategy session."
6,Rockwell Automation,9.5,Enterprise AI,"95% of Asia Pacific manufacturers say digital transformation is now essential, as AI adoption and cyber risks accelerate - Asia Food Journal",Asia Food Journal,https://news.google.com/rss/articles/CBMi4AFBVV95cUxPSDFITXRIbTZLZTQ4RlNtNU1PdzR1QlkxSDF3cm5ZVUlSUnZ2YXNPWDd1NXpPTkhXLVVCME81NzRRREV6T1I3akZSa2hBYTRQRHYwWmdiLVo0YThOU2JNUDRYeTU3LUU2UjA3MXJxbEdDV2hyRlQ3eHdISTVvc05oRkprWkN2amd3ZlJMWFI0ZTY5MDh3YzN1R1RtT2RLTUxUWmt5N0NEU1F2STJnd0FOczExSktGQTgtZE5WZlFNMG85WTk5eW80d3VwY05OUzg4Y2Zyb2E4ZWlCYm82ZU9Ddg?oc=5,"Fri, 22 May 2026 04:33:42 GMT",2,"AI adoption, digital transformation",Liatrio helps enterprises move from AI pilots to production-scale AI. Offer an AI Strategy Session.
6,Rockwell Automation,9.5,Enterprise AI,New research shows UK manufacturers shifting from AI adoption to industrial execution - Plant & Works Engineering,Plant & Works Engineering,https://news.google.com/rss/articles/CBMiqwFBVV95cUxNQktTc0ZjRGdFSk1uT0dHaVFkQ0lyVmV3UlBOVHNDWUR0cU5WcUcxc1NHT1FDVEJXSWxTQXdsMm5JdFU5SHJua29maFVndFEzNlkxUzRNMHhGWnhwT3RhQldwbnl6Vi1QYjlLVklncFFNeEhCVU51SEJuRkpQc2p5dkJoNFNuOFlwNUFoVkJQTXl2N25rek9kZjJybnlVYjBQME1kWklPMGpvZ0E?oc=5,"Fri, 22 May 2026 08:16:37 GMT",1.5,AI adoption,Liatrio helps enterprises move from AI pilots to production-scale AI. Offer an AI Strategy Session.
6,Rockwell Automation,9.5,Enterprise AI,Rockwell Automation Announces New Research Showing UK manufacturers Shift from AI Adoption to Industrial Execution - PR Newswire UK,PR Newswire UK,https://news.google.com/rss/articles/CBMiggJBVV95cUxPUW82WEZ4UjlwU1l5eFRwblhUakUxU1REX1pUdEZ1ZEJ3VFdvZUtVZUtKWW9QWnJXcFJGU0RESVZwdGpXNzFreG9YdktGeXpWT2ZfclVnZ3pYZnpVb3J2VGl2cEZORkNrbFRWZWQ5eVFhOWxCLW5uNG9YUjh5T1hhR0g1cmVsY1lheFZyNkQtOWY0WDNnZHU0cGY5VWExakZLZmhsUk1QY2dJS0kxUnNfc0g5X0xNamkxbG9rM3ZZYmstTkxkVl9sVFVral9sSkRBYm5HcVVTbDMwM2xaTzhIb2RpWWtkd2g4bHlVR2dxSFc1YzJldWc4enQtU1MzU1lETFE?oc=5,"Tue, 19 May 2026 11:00:00 GMT",1.5,AI adoption,Liatrio helps enterprises move from AI pilots to production-scale AI. Offer an AI Strategy Session.
6,Rockwell Automation,9.5,Enterprise AI,ROCKWELL AUTOMATION TO ADVANCE INDUSTRIAL INTELLIGENCE THROUGH EDGE-BASED GENERATIVE AI WITH NVIDIA NEMOTRON - PR Newswire,PR Newswire,https://news.google.com/rss/articles/CBMi9wFBVV95cUxQWUlYUEJ6Ql94MzAyMDdDQW5BMnVaY1VVbXpyTFhadzlTYXVCRHZNOXhxbllDSFE3NEdkcDg4VUw4WUhkVVZMeW5DM0lkS3pCcVRURy1QX0RQa1RZTkI1clNKbG1BX1VNZDIxVGRwNVB3em5EcHFnLWR2YWlGSVJzeWVsd1hQSVlZZGUwelBSMzViZm1FLWRPenpPMmtBaHFyX1JjM29UTnhmSHVqaFVIMU1yWEpYM3A4eEFNcUVfS2xjVUVlM3FSU0pUSnJVU0hYUTQwd2NmUExZaDQ5X3lHQU5Ub2g1bFRDNXpQbks1MVZxT01Fd2dJ?oc=5,"Thu, 13 Nov 2025 08:00:00 GMT",1.5,generative AI,Liatrio helps enterprises move from AI pilots to production-scale AI. Offer an AI Strategy Session.
6,Rockwell Automation,9.5,Security & Compliance,WEBINAR: Modernizing Control Software - SDLC to DevSecOps for A&D - Aviation Week,Aviation Week,https://news.google.com/rss/articles/CBMinAFBVV95cUxOVFFlRlV6TllXbUlYS0YtZHRvaklsdlRTQmcyMVhjU2F0VTR0bWRJUkROeUQ0c3lmclNpM1BkbmFWRW9FQVBBMmc3YTBEczhCR0hPd0o4VmpGQkYxQUxKT2prWFZ0b2QzVm1zRmtfQWY0QzlTNkoxeTc1Q0R6NVhVTkREVFNLX0Y3R1gxVUlQRml3WW8xMHk0blduNWQ?oc=5,"Mon, 21 Jul 2025 07:00:00 GMT",1,DevSecOps,Liatrio integrates security into the software delivery pipeline. Offer a DevSecOps assessment.
6,Rockwell Automation,9.5,Application Modernization,Rockwell Automation goes cloud-native on Azure to bring modern software development paradigms to the factory floor - Microsoft,Microsoft,https://news.google.com/rss/articles/CBMiuAFBVV95cUxNenRQR1RCcVZmOGJRN0RicXR4dEJnb0JoZGxDd1drQXlxbVlXZVlDRURBbU9CUjBSQ1lTSTExaEpJQ1hHbEVCVFd5cVRjVjAwbmtuWXBvYmFUcjN6UHMwOU9iRDh5Q255SUpnWkx0SlBlQ1poUmo2ZXlvMkdBa1pOVm5kSzhHU3k4aGw0UlJhZEdWSmNSRjBhTm5Ic2lCVFRVVDVLcEhYVi1mdlh1TGJIUTRIN0ZfSllG?oc=5,"Mon, 02 Oct 2023 07:00:00 GMT",1,cloud-native,"Liatrio turns legacy apps into cloud-native, AI-ready software. Offer a modernization roadmap."
6,Rockwell Automation,9.5,Digital Transformation,"90% of Manufacturers Say Digital Transformation Is Now Essential, According to New Global Study | Corporate - EQS News",EQS News,https://news.google.com/rss/articles/CBMigwJBVV95cUxNRDJkdXZzVmZXNEh3RFFHeFdTOEQ4QXRrbkRhZTE5aGhNejlCN1RFdTFudk5RMklwd2RBdHppZmk0cVhBelVEckdxVHN3aEJlVnpQRVhoZldENmpPX2JCTnAtUmRXZjFzUFpXWUhJUm1TRXBqdExYRUNLUlpVSVJudW8zc3lyNlVwS1MtZmtIV1hFMjJEOVNObFBMcnRTVW5xeFozOHV5aXVQbnVtOWJvMDdoMDk0YVc0WFZfTUp1Z3BpbzRNMGd6bklET2lsaEFXcm5YS2VudENJbFREbHdiTnFMN0lNNk1ZZHVlUDZZamdHT01UZWpLbHRGclpVYy0tUk5n?oc=5,"Tue, 19 May 2026 11:06:37 GMT",1,digital transformation,"Liatrio drives holistic transformation across people, process, and technology. Reference the leadership change and offer a strategy session."
7,Honeywell,9.0,Security & Compliance,"Identity, Zero Trust, and Secure OTA: The New Baseline for IoT Defense - IoT Evolution World",IoT Evolution World,https://news.google.com/rss/articles/CBMiqAFBVV95cUxOb2JrMW5qX3BGMnZ3RTdta3g1MVBFbGQ1eXlJZlFZQU1RZ1RGbHh5TWhnbXIzOEFoaU5oYmlyQ0tHeGFZalRKTVpFTThPWWxtVnNLQlh1WnBXZnZCSllhRFk0eGh0V0pWMVh5aVo1WHFYdzFoSXlrcU5EVXMzb0JhWmNPYlBNMlFKM01TbEFLeDBDVGhuTXVBcGhsOGtFZWg5S1duTU8xaEo?oc=5,"Wed, 11 Mar 2026 07:00:00 GMT",1.5,zero trust,Liatrio integrates security into the software delivery pipeline. Offer a DevSecOps assessment.
7,Honeywell,9.0,Digital Transformation,"Airbus, Honeywell, Lockheed Martin, RTX, and Safran Lead in Digital Transformation Among Aerospace and Defense Manufacturers, According to ABI Research Index - PR Newswire",PR Newswire,https://news.google.com/rss/articles/CBMisgJBVV95cUxQbDdqOGgxakpVSUFMc25NOE5PYVVPLWNrblJQTkx0d05NUGRLQkFnVGtyc3V5QUFzQ2RTQnpzUU9rZlhITW9HZC1EakdLLXg4MWhkMjhoQ1VJdlUxX2lISnl5Uy1QNEV6NEdlakJXNDF4Nnp3alF6NVI5NGJBRjVSd3piUGVwaUFEbWJQYWdfRUwweEdJTS1iZjMxZWthTVZKOUFyVGk5c25RS0NOWXRpcFI3TUxFeC14NkdDQy1PSVUtMVVyNGg1VmJvUWhpbzQwWFVHaDk3UXRCR0IzdDZ0REFKQU9zU1RFdEQ1UXVkNFpIc3lYbGduSXVtQzQ0d0FvcGdVejdIVUFtN3pYRFdmRW9tQnc3ZjBnMXQ5RGx0eWp6Y1dEenlnM29CSFIzNFpLM1E?oc=5,"Thu, 18 Sep 2025 07:00:00 GMT",1.5,digital transformation,"Liatrio drives holistic transformation across people, process, and technology. Reference the leadership change and offer a strategy session."
7,Honeywell,9.0,Application Modernization,October/November 2021 - Meet Anthem: Honeywell’s First Cloud-Native Cockpit System | Avionics Digital Edition - Aviation Tech Today,Aviation Tech Today,https://news.google.com/rss/articles/CBMizwFBVV95cUxQV0hMLU90a1k0dzJsUEc2czFYWmdRVGpzdXA4NW9zMnp6Y0pTemRENnBnYlRKQ2JhdUpqeTJheDVzYXU5c2ZNbmVpRTZNbWRzcVA1ZUJlR3FSVTJUemZPZFBHYVAtcmd3elRNTG9YSVRfc3dIQ0UwVnZ0RHYtQjdCd1A1NDlXNXp6c0hOUm5rRkhqdU9kR0lhLVhiU0NJb2xTaDNSVGJGbk9acEhHR0RnTEgwcXVkeG1XOXJSdTlyWlJLd0hMc0JURHFOdmh1TDg?oc=5,"Thu, 07 Apr 2022 13:35:50 GMT",1,cloud-native,"Liatrio turns legacy apps into cloud-native, AI-ready software. Offer a modernization roadmap."
7,Honeywell,9.0,Workforce Enablement,Honeywell unveil AI-assisted automation platform - Fire & Safety Journal Americas,Fire & Safety Journal Americas,https://news.google.com/rss/articles/CBMilAFBVV95cUxNWlB3cEpRdExydVdUVVNKNEdVUmZzRGJBMV8xV0lLOHF6RUNXeTBUc3h6OU1xeDV3cmY1YThXekZLZllPZGwyU3ZFWGdubnBFaGlsUXRQWVo1YkRXTTVycWdUa1QyTlBxblBjamFZcUdvZld2Q0hKOVIxdzZleVZGN1pBMmh4c0I2aHYtNm1iY3l6bmxh?oc=5,"Mon, 07 Apr 2025 07:00:00 GMT",1,SAFe,Liatrio coaches engineering teams to become high-performing. Offer a team enablement workshop.
7,Honeywell,9.0,Digital Transformation,Honeywell prioritises pragmatism in digital transformation - Mobile World Live,Mobile World Live,https://news.google.com/rss/articles/CBMiogFBVV95cUxQVnBhaHBNN0R3ZzZMZlJINHNZSWttQ3RPbUtjVTBXMG9DbWhxczhGal9vRFpWVVJQMWtDbzkzdjY3NG0xZTBDaXp2QVJYOGFnQTB2ek81b2djRjdMYU5jWERGcjVuQ3U3cHdIazYyVzlXS0taUWw5djJ1V3NzVXhYVFo3TC1Qc051dWhYRkdSMTJLSy1NdXViRUVTU2lxM19vaVE?oc=5,"Thu, 18 Sep 2025 07:00:00 GMT",1,digital transformation,"Liatrio drives holistic transformation across people, process, and technology. Reference the leadership change and offer a strategy session."
7,Honeywell,9.0,Digital Transformation,How Digital Transformation is Enhancing the Rail Travel Experience - Honeywell,Honeywell,https://news.google.com/rss/articles/CBMilwFBVV95cUxPM2hfOVBvMkpoWDlid0FnQmN4eXBSaWdUSGhXSWhVeVZObWdkRWVOeXpsN2VQZmFFTkdUSGdPNlZvSE5YNTgtQTYxSlFMVUxNQVYzNFU4aUx6VjVBenB5OXNvRGJMSUJjX2RCSFBGcUFVQ21sUUFWcWdRNzV2STdKaXZyanRyNnE0cDY0QzZSVjI5aGMzeV80?oc=5,"Thu, 12 Jun 2025 17:51:27 GMT",1,digital transformation,"Liatrio drives holistic transformation across people, process, and technology. Reference the leadership change and offer a strategy session."
7,Honeywell,9.0,Digital Transformation,She helped build Disney's theme park database. Now Sheila Jordan is leading a $38.5 billion Fortune 500 giant's digital transformation efforts - Fortune,Fortune,https://news.google.com/rss/articles/CBMikgFBVV95cUxNeWtyS0hyMktLeDZTWTRIdlNPVkJsbGRDZGtuaUtreVd4SEw5dnJhN2ZpaWlHR1Z4ZVNROHlWN2JjMGYxVHNyN1NYTFdyVEZLcnRXSzRENHFiSEtKcHZLREU0bGV2dWhRTmVzUmpfYkVBMTByZ0x6NVpFWGJ2ZF9XR0gxZzJjc1RITk1vUmpvc1BkUQ?oc=5,"Fri, 13 Jun 2025 07:00:00 GMT",1,digital transformation,"Liatrio drives holistic transformation across people, process, and technology. Reference the leadership change and offer a strategy session."
7,Honeywell,9.0,Digital Transformation,"Honeywell Users Group 2025: AI, Autonomy, Digital Transformation - Mexico Business News",Mexico Business News,https://news.google.com/rss/articles/CBMioAFBVV95cUxObTE2N2hxcENPMnFxV2tmZG13eThzVXhCWmxWTnJlX3M3WWRxZHZxVjlETnRKWkw1RUNXcnFVWnNmQUpGWV9SLUhsOUh1N19aMVpVOFRnT2Zfem80eXR5NERoMWtVWTEtdDQ1c1RHbW5NTnk5UlRYQjJxdmRDblY5LVFldC1jMDc0SlFrSlNEZVBMYnhOeC00TE5UTGxvb3dX?oc=5,"Thu, 12 Jun 2025 07:00:00 GMT",1,digital transformation,"Liatrio drives holistic transformation across people, process, and technology. Reference the leadership change and offer a strategy session."
8,Chevron,7.5,Enterprise AI,Chevron AI Strategy: Analysis of AI Powered Dominance in Energy - Klover.ai,Klover.ai,https://news.google.com/rss/articles/CBMijgFBVV95cUxNSDFsZ1lJUWkyYnl1ZEpEa2pmWHJObVp2NWp6bVpGUnVVTGZBdEVhX1A1T3JoeXNrX1VJTUExM0FndlZoREdwMzZfaGFlRXhZZ3hGcEFrNHlUN3JPOE54OXVfVkNweEotdTRnbEd3NDI1b0VnMGJiRWNLd05kdXZPZm5rUk8yODU2bVliTFRR?oc=5,"Tue, 15 Jul 2025 07:00:00 GMT",1.5,AI strategy,Liatrio helps enterprises move from AI pilots to production-scale AI. Offer an AI Strategy Session.
8,Chevron,7.5,Cloud Migration,From 30 days to 1: Chevron's cloud migration ROI in real numbers - Venturebeat,Venturebeat,https://news.google.com/rss/articles/CBMiqgFBVV95cUxOZDJBS1ZXWVJFZTZQYjR0S3NzMUlUR0hPNEhocUdRd0x4RGlQT1U3YXZLanl6d2hnZk81Sjk2a1dzeVZXQkpxS2pSVHloUGhGNzdxSElhd3ptWkRoSXl4UTFEWmJGZnRnWjh5cTBxS3FSTVZVZFIwR3kxMEtDbGRTTDU3ck0yaUs5QU5DMW5ORk42UGdSWl9JWWExTnFObkowQ043d3lnN1RDQQ?oc=5,"Tue, 01 Jul 2025 07:00:00 GMT",1,cloud migration,Liatrio designs AI-ready cloud platforms. Offer a cloud migration assessment.
8,Chevron,7.5,Application Modernization,"EMnify Brings Cloud-Native IoT Connectivity to 20 AWS Regions, Simplifying Secure Cellular Device Communication - IoT For All",IoT For All,https://news.google.com/rss/articles/CBMiU0FVX3lxTE9yNHE3cGpId3NzaXVGNGR5aFZ2VG11NmxjNHhqS1VQUDhQZVc0SWtzSGdPYmI0Tzl4aEpTTXlaZllrMjhaTDNRR2w1LXloTEVBUWFJ?oc=5,"Mon, 29 Mar 2021 07:00:00 GMT",1,cloud-native,"Liatrio turns legacy apps into cloud-native, AI-ready software. Offer a modernization roadmap."
8,Chevron,7.5,Digital Transformation,Chevron fuels digital transformation with new Microsoft partnership - Microsoft Source,Microsoft Source,https://news.google.com/rss/articles/CBMiqAFBVV95cUxQcEpLRkhFOVZmSmdOUjRFNndTLWhyVWVfVFRpUnFJYzBCZ0hieDdleVFmdFFINVBUV0lWQ1ZxN0lPZlFwcFRSQ2lSV1lIamhPNFgxcVVhWVo2M3FoWkZnX1hpTGdjUzgwMTh2bnlQTEU3TjgzdlctZU1tNmZWeGpSZUhjbElERnRoY1ZHSTdNdkJVQ0xXelY5dnRETkw3RUtMNUxWV01qVnQ?oc=5,"Mon, 30 Oct 2017 07:00:00 GMT",1,digital transformation,"Liatrio drives holistic transformation across people, process, and technology. Reference the leadership change and offer a strategy session."
8,Chevron,7.5,Digital Transformation,Fueling the future of digital transformation - MIT Technology Review,MIT Technology Review,https://news.google.com/rss/articles/CBMingFBVV95cUxPeGt1Y2VQbGt6d3lPN21OVGRocFF0Z0tSSHpSckoyaVkxMk94S3dxNmNLSjE1aG1wYXBKYUw4Y29qRkNROF9CUThuY1BlUmpCNkV2VUlkMk45LW5td2xrWmp3dmkwNExlNkpGWnBIWHhNRXNDY05iZ1Q2SVBIQ1BNbm1aOGNTSzg1Wm1tZlN6VVI4aWNTb2h5bC03NlJyd9IBowFBVV95cUxNNnloSWM4amR3X2IyV2RWZDZic3RzU192SjUwNmRULUFJWk1pdlJQaUVqOVRSNDlRN2VWay0wckxSc1J3blRfRWNDLVY5VU8ySDdJYzBlUWJ0b09DV09QeHBYam8zZGtSODFKTGZkcTE0UHdZYjI0cDN4WTRKVno5NE9WSDU4TjZiczFjMGVKZXR2d1dheW03c25LUzJhMTh0TnNr?oc=5,"Wed, 15 Jan 2025 08:00:00 GMT",1,digital transformation,"Liatrio drives holistic transformation across people, process, and technology. Reference the leadership change and offer a strategy session."
8,Chevron,7.5,Strategic Signal,Chevron Lummus Global awarded contract for Assam refinery expansion project - Hydrocarbon Engineering,Hydrocarbon Engineering,https://news.google.com/rss/articles/CBMizgFBVV95cUxQb2tDZzB4SFlRcks4RkVHdFRnRFZydFZLRnlxUkgxVUh5SDJTSTF4TlZWM0FLMV9FMHZ3MThyUXZDdjhXRzB6NFROTkhsRkVMLXhyRWVuaDk0MTUzZUJMRi1LcTFpcjhTY0s3QlhiWWszSDNkQjFEVUt4ZUNXckczM3VYQ01ZZm1mc3dsclYzVTVfenFNZ0xJMU12VGNKeldQWHpMZGdIdDJucHBDcjVsR3AzNWZ1R3QwUnBJTFVWOV9aWEpIVGdkNTFfTE11QdIB0wFBVV95cUxPQkJGS25VeWNCNFI3RV9MUm1FNnBrR3lHWVFpdU1QQ1EzTDBLbnpzWFNNbEMtbE1nUlMtdnRPS3VMOUdEbHNzN1k4RTBYbHUtckZLc1ltaWVfV3hJRXVrUllpTFg0WUFYbkZlT1FjVFJ2VVM3VjRhNHlSanFkSkZIRlowVGM3Wm5mZk5WdXdkTnRWTWoySVdvOFF3c3NYQkJod21IVnJraklsT0JBa011V1FUV0doV1I0MDdTRmt0Nzl0SWNmYWZyTnpvTVpWMXBkbVVV?oc=5,"Tue, 02 Feb 2021 08:00:00 GMT",1,expansion,Company is investing in technology. Position Liatrio as their transformation partner.
8,Chevron,7.5,Strategic Signal,Chevron Lummus Global wins refinery expansion contract in India - Offshore Technology,Offshore Technology,https://news.google.com/rss/articles/CBMikAFBVV95cUxOaWV1V0N5ek1samxVNlAxYV9pQ2UyekV5QmRtZE5IQkxmdWxrblhMXzdVVVdRVWZHcTV4UWtHMy1LeGYxOFg4ajRpVEtIT2xFVC1IenNiRmdiT2lNUjNxaGRpem81cHllTnBfNEVvd0JUdTVmRWRoeTdhQnVmdWk4Mk02Smt5SWRtQ1VLdXd6NDM?oc=5,"Wed, 03 Feb 2021 08:00:00 GMT",1,expansion,Company is investing in technology. Position Liatrio as their transformation partner.
9,Johnson Controls,7,Enterprise AI,Johnson Controls International’s AI Strategy: Analysis of JCI’s Dominance in Smart Building Technology AI - Klover.ai,Klover.ai,https://news.google.com/rss/articles/CBMiwAFBVV95cUxPc2Z0eDRxd2F0ZElLMWpIX1FsOFNfM3h6dUo1M2NadU9mb2dyLWR5YUhEc0hCNjhmbzlmX3NUNjdCNkhwbGRmUjRiZzBJTWUzX1R5Qk92TVpvWFF6a2tVdDNqUVROOVZ6VjNveXBOUThXRktfUWlnSnJUaDU0QTBNWk9oZWxBNGNTejNVUXQ4NnRMTm8tVHNha09PaTd6VGdkcHNyQ2cwSGxxUjlBODB6YUxXcjRHai01S0ZsYWhuQUo?oc=5,"Mon, 04 Aug 2025 07:00:00 GMT",1,AI strategy,Liatrio helps enterprises move from AI pilots to production-scale AI. Offer an AI Strategy Session.
9,Johnson Controls,7,Cloud Migration,ROSA by Red Hat and AWS simplifies hybrid cloud modernization - SiliconANGLE,SiliconANGLE,https://news.google.com/rss/articles/CBMirAFBVV95cUxOeFlSbGdMX3NNSjllWkd4NG1DMld2N2tJTDY4OG94Z3VfZ0xEcE8xNEYxc1BGLWFpeGs2NEdOY2pMOE05V1o4Nk5PNnNEb2c1eEtsaDZuMVBQempDOXduRVoyeUdxSEpqN0l4aTZMM25KREJEalJ2akNTRHVlWTJVNXhuU2VvWHVfdnUwSmQ2RHVyd2huR0xKeDE3MmNqNm9NNkMtOGtHRDRfenRN?oc=5,"Tue, 27 May 2025 07:00:00 GMT",1,hybrid cloud,Liatrio designs AI-ready cloud platforms. Offer a cloud migration assessment.
9,Johnson Controls,7,Application Modernization,Johnson Controls rethinks IT for the cloud-native and AI era - cio.com,cio.com,https://news.google.com/rss/articles/CBMingFBVV95cUxOSndHSWRkWlEtcWdZWl9YbnVuYU5IRHlDYzg2aWZOWFBEZGZaQzBwR2pwdnNkQi1va2trTzVBYTJEd3YzakJPa09SX0VfLUN6X0N4enZvSXVZY2RJV1dnVEF5Nl9JUTZFX3hUUDRScnlDakwyNll5SmVMSmdJb0sycVlhVmhNN1RkOXhkZXBJVTliSjVxWWxBV0RwN2k5dw?oc=5,"Mon, 05 May 2025 07:00:00 GMT",1,cloud-native,"Liatrio turns legacy apps into cloud-native, AI-ready software. Offer a modernization roadmap."
9,Johnson Controls,7,Security & Compliance,How FedRAMP-Certified OpenBlue Optimizes Government Agency Workplaces - Johnson Controls,Johnson Controls,https://news.google.com/rss/articles/CBMi1AFBVV95cUxPNzNZR0trd1dscXl2VkVHODFNSXlxUk1jNndhRTBab0Vzb3hYRmluVHRCX2QwQ1IybmtpOXlkSzhVS3hfcjVfRUF3X2NrbWltLUNVYnBNQi1zU2R3T1VnR0VXb0trU25rODQxTWY4NDFpalpyc3lvNUlsR0RFRVRoVXJhdHozVlE2djFwNVdoWkJSV1hSRkpTRFBmN3pTUENPVVRhOS1VaFpwekxRT19Tc0NHY0lvaVRvdFllTWlSNUNFY1ZkZURpOG5QY3hEU1BjN3I1MQ?oc=5,"Thu, 25 Sep 2025 07:00:00 GMT",1,FedRAMP,Liatrio integrates security into the software delivery pipeline. Offer a DevSecOps assessment.
9,Johnson Controls,7,Security & Compliance,Johnson Controls acquires Tempered Networks to bring zero trust cybersecurity to connected buildings worldwide - Johnson Controls,Johnson Controls,https://news.google.com/rss/articles/CBMiuwFBVV95cUxOYWJrOUhoM0c2TU5ZeHFPcWphVlVDMXlqSXZCSTVKbW5yWEl2UnJGWml2UjBlckdLMTJ4UVRtNGFlUmtmRWRvTmFKR01zRk5wLTlyMXk1djZQNlFHcmExX0x5WG8zSVY4Y1dMU0J6LU5ocVYwM043OU85TzhHS3VaMW1IX1ItNm80ZWo0NlBtMkFHTzRRbkdySGp2aEIwak5PenpfZERwS1V5cEkxaVNXSnNKZHpUZFBKcU0w?oc=5,"Thu, 23 Jun 2022 07:00:00 GMT",1,zero trust,Liatrio integrates security into the software delivery pipeline. Offer a DevSecOps assessment.
9,Johnson Controls,7,Digital Transformation,Johnson Controls eyes digital transformation - China Daily,China Daily,https://news.google.com/rss/articles/CBMifkFVX3lxTE1VaHA1UG0wYTM4YS1OVkl2ejJydVdXTTUyMDFsTXlPS3paZlRtbEs0ajJwV0h0bVlQNloxMGZSLXNPY2JXTGJJb08tbEtVdVF3a2E3cUhlX3RCT2ZXNy1xdzFFS3hqRWJiaENfNmVkdHdwcVg4VHV0OHMycHQ1Zw?oc=5,"Wed, 02 Jul 2025 07:00:00 GMT",1,digital transformation,"Liatrio drives holistic transformation across people, process, and technology. Reference the leadership change and offer a strategy session."
9,Johnson Controls,7,Digital Transformation,Partnering to drive digital transformation - Johnson Controls,Johnson Controls,https://news.google.com/rss/articles/CBMiYEFVX3lxTE01S0VfcDhhNmJpQllZMTEtSHBzWjZtLTFtcXZuOGJTTW9vZXBWc0FRODFlamhqeExySVhJOGs3TEg2NzF4U1pRQUNHalZPNHlhaGRta3hDcmNsUm04V3BxbQ?oc=5,"Sat, 03 Sep 2022 02:25:44 GMT",1,digital transformation,"Liatrio drives holistic transformation across people, process, and technology. Reference the leadership change and offer a strategy session."
10,Emerson Electric,6.5,Enterprise AI,New Emerson Industrial AI Platform Delivers Enterprise-Scale AI - Quantisnow,Quantisnow,https://news.google.com/rss/articles/CBMiqgFBVV95cUxONms5OTNWbWdUMk5jOW9xZDQ1MWl2b0k5c2t0V3B5eDR6UC1wclVhdEhBZWJELUNRUi1PaVF1OEUyQVVqQXVXUXBXN25kYk4wUmIzQXRWZDlVbnBOZ2hST3lYbkRMd0NaSUpSV2t6S0lBNjFEUXBWaXBmczdObG81aGZUcEZ6Mm84YzF1c2c4VVB6M1dKMktKdGVXU3MtYnk1S3JjN3VVeDVmQQ?oc=5,"Mon, 11 May 2026 07:00:00 GMT",1.5,AI platform,Liatrio helps enterprises move from AI pilots to production-scale AI. Offer an AI Strategy Session.
10,Emerson Electric,6.5,Enterprise AI,New Emerson Industrial AI Platform Delivers Enterprise-Scale AI - Moomoo,Moomoo,https://news.google.com/rss/articles/CBMiqAFBVV95cUxQcTZ1R3hfOGxtS05xN042VGt5emFvT1V5dGZPeEt6ZWI4cE1NZThnNXN5XzNWQkExbVp6M09VSm1fN25TT0hRWmxzbVpIVG5FdTBqc19BN2pjWU9LSUZTSS11ZzRTemYzcHdzclBlMGpKUWJYcFphbWFqRFB5eF82Nlg1WlgzbEJhZTEyOGEyOVFBalQzMElTNjBXR3dKV0pvQ3BxTUkzbTE?oc=5,"Mon, 11 May 2026 13:00:00 GMT",1.5,AI platform,Liatrio helps enterprises move from AI pilots to production-scale AI. Offer an AI Strategy Session.
