company_rank,company,company_total_score,liatrio_service_area,headline,source,url,published,relevance_score,matched_keywords,outreach_angle
8,Johnson Controls,9,Digital Transformation,Partnering to drive digital transformation - Johnson Controls,Johnson Controls,https://news.google.com/rss/articles/CBMiYEFVX3lxTE01S0VfcDhhNmJpQllZMTEtSHBzWjZtLTFtcXZuOGJTTW9vZXBWc0FRODFlamhqeExySVhJOGs3TEg2NzF4U1pRQUNHalZPNHlhaGRta3hDcmNsUm04V3BxbQ?oc=5,"Sat, 03 Sep 2022 02:25:44 GMT",1,digital transformation,"Liatrio drives holistic transformation across people, process, and technology. Reference the leadership change and offer a strategy session."
8,Johnson Controls,9,Digital Transformation,Johnson Controls Names Sankaran to New CTO role to Further Expand OpenBlue and Digital Technology Solutions - Johnson Controls,Johnson Controls,https://news.google.com/rss/articles/CBMihwJBVV95cUxQaVdMd2lJbkVnN3h3Vlc2VXR5T2RxbUFVb2x3OG1OTC11dXRqVDlhT1d2bkZmYmdpbFdDTjhldjVoVU5jZy1qSDR5Z0dxVWVkX2p0S3FRbWY1aGF4Qnp1aEtpLXhyV3g3TTRCQXExQ2EzUTgtcm16N1dQeHZ0bERaY1BuY0UyMDVTcVByZkVMOE5QN2pqUjRSdDR2Q3BBTGNyVG83cXNjYnduM3haLU5qMU03c3JDeU1jTWlGZ2NTNEM3N0c3WGJ6Mk5VMk0yWmEzQmJieHJ5djdQNXZYVWJickRHbnEyUGtYamRMQTl0U1liRlRKQ3doTndmNzdiSk1MSEdmOUlYNA?oc=5,"Tue, 11 May 2021 07:00:00 GMT",1,new CTO,"Liatrio drives holistic transformation across people, process, and technology. Reference the leadership change and offer a strategy session."
9,SAIC,7.5,Security & Compliance,"Xage Security extends zero trust to AI, promising safer data access and multi-agent workflows - Industrial Cyber",Industrial Cyber,https://news.google.com/rss/articles/CBMiwwFBVV95cUxNSDhpQkZZYWxnTXVPYUhlQWhJS1pUazRzNE1oTTgwLU51a3JUb3BoaFdGUzNPcDVXYS1oSVNuaVBzOWxoR05UYUtfRHZFc09QZ2hFTzd4VWVaUTZjQXg5SGsxMXdLYnhRbjJ4cjNkQzExenRFTGNoZ2JXQ1VsM3dGYkIxb1BrTnQxOEs3c3d3YnhSX0g4XzBJY2NSZE1HNWxpUUtzVUMxbmlKZ3B0ZHRrN0J5RE1lWG9OMlZoMEhKWVk0d28?oc=5,"Fri, 12 Sep 2025 07:00:00 GMT",2.5,"zero trust, SAFe",Liatrio integrates security into the software delivery pipeline. Offer a DevSecOps assessment.
9,SAIC,7.5,Cloud Migration,SAIC Wins $85 Million U.S. Navy Contract for Software Support and Cloud Migration Services - Business Wire,Business Wire,https://news.google.com/rss/articles/CBMi4wFBVV95cUxPTlJEZE9IWHBfVmdCZEhyRmJsMHg1MTByWEV1eXZoall4UmphRmlHZHpJS2RucEhYYlhlTHZGdDh6X3U4QzZFS2VzWlRGX1JTbjJMUGdsMkVZT3RqUFZ0Ny1DWElNNHhjVFhVVWpWbllnb182dm9iU29BdWNzVHpzNWgyZHFRMmc5ell2blhiNTJsa0IxR1kwVE9sZ2txdzg0V2U0bGwyR0VJY3J1Z1d3WVJZempqTkhibWQ1Y3ZUemFMZDgzM3poTHBjSlVibGpnUEI2bXdMcXJ5VkRSbURnVDloTQ?oc=5,"Tue, 27 Jul 2021 07:00:00 GMT",1,cloud migration,Liatrio designs AI-ready cloud platforms. Offer a cloud migration assessment.
9,SAIC,7.5,Digital Transformation,SAIC Wins $95M GAO Contract to Support IT Modernization - GovCon Wire,GovCon Wire,https://news.google.com/rss/articles/CBMic0FVX3lxTE12NU5NdjZqSGNnQmRQUG55bEtqb0VmZWtHaG5pbmlvaU5xVXNsX2ZUNkM2SFUtcDZHYWd6TlF0OGI0eURXTkExWHhVVzhQVFRfbGdWZ3ZlRklEUi1PVnpLQnpKbWVzS1dKcHdXVGQyeENGUU0?oc=5,"Fri, 27 Feb 2026 08:00:00 GMT",1,IT modernization,"Liatrio drives holistic transformation across people, process, and technology. Reference the leadership change and offer a strategy session."
9,SAIC,7.5,Digital Transformation,GAO Awards $95M IT Modernization Contract to SAIC - MeriTalk,MeriTalk,https://news.google.com/rss/articles/CBMiiwFBVV95cUxNOXhUa1hKOG1IM21TS18wUFhMeGdOV1FKbjRmeFdYQ0toMy1FRHlHV3Z4SnpzRjhKVW8wYmYxQTByaERhYjQxVmgwU0N1MlBRbUNzZ3o2aktPTE9IRnUzYjItOTZTaG5ZNS1kZEF0TV9OR1RHUC11bHN1eXN2Wkt6SFJvUloyMlRPdEE4?oc=5,"Thu, 26 Feb 2026 08:00:00 GMT",1,IT modernization,"Liatrio drives holistic transformation across people, process, and technology. Reference the leadership change and offer a strategy session."
9,SAIC,7.5,Digital Transformation,SAIC Awarded $95M GAO IT Modernization Contract - Homeland Security Today,Homeland Security Today,https://news.google.com/rss/articles/CBMimAFBVV95cUxOOGdoUzA5R3VaVDU5UkdOaHJRSS1zYy1kb05qQVJacDQxVS1EYUI0dGVvNExHSW8xM0JWTjh3R3N1QTU0Nm9jV0tRZzVGa0NvNXpIVkJ6ZlB0RWExbzVYWDBqc195WFF6SFpVczhjeUFxRXVJN21Cd3d1SnM4RzUwRC1vR0JPTkNOSkdVWTZ4allqMm5GNlAtdQ?oc=5,"Fri, 27 Feb 2026 08:00:00 GMT",1,IT modernization,"Liatrio drives holistic transformation across people, process, and technology. Reference the leadership change and offer a strategy session."
9,SAIC,7.5,Digital Transformation,SAIC Awarded New $229M Contract for DoD IT Modernization - ASDNews,ASDNews,https://news.google.com/rss/articles/CBMioAFBVV95cUxPMWt6TG45SmNfUFd0YVRFdWVRVHY5dXBOczJFcEc2Q0l0MDUzaGhDZnlFN3RXQkVvejg0VkthMGNyMnV4OGVTMnpOOEdWMWJrbmFmM1ZUV0g2NF9ZMVQ2YlM5bDYyanZFc09TMlBYbTdFWW1yczI1b2pNLXR3aXUyeG1SY09aejhrQi03VDh5cURXQjQ2VUI2NWFsZGxxSkND?oc=5,"Thu, 19 Sep 2024 07:00:00 GMT",1,IT modernization,"Liatrio drives holistic transformation across people, process, and technology. Reference the leadership change and offer a strategy session."
10,Halliburton,7.0,Enterprise AI,Energy companies in Latin America deepen AI adoption - BNamericas,BNamericas,https://news.google.com/rss/articles/CBMilgFBVV95cUxOV0JxUkpuNDQ1blMwLThmSDVjNjF1RENaeXMzUEZOMFVGTTh3dDdhNUZBMmNQTkUzYlozdnZtekdUYVJQQk9sWUM5YlZvLXRfX29ZX2hIZC1wcERLNzQ1ZDA0d0lES280RzU1MG9GRHFUNXhnVWszWEJoQlpoNTdSQ0NJT3FLVlJ6d3Fab3pIMUhPa1JDUEE?oc=5,"Fri, 06 Feb 2026 08:00:00 GMT",1.5,AI adoption,Liatrio helps enterprises move from AI pilots to production-scale AI. Offer an AI Strategy Session.
10,Halliburton,7.0,Enterprise AI,"ClassVI.AI Rebrands as Permeta, Expanding Its AI Platform For Energy Permitting - USA Today",USA Today,https://news.google.com/rss/articles/CBMiygFBVV95cUxNZGZsMmtXYkIzM3B3OUMyNXZmOEtHM3Y0UkdTZ2F6dlNRbEZva3dRazhkaGpMRUhNUldxOTh4SnpWUlAxUUlNbzd0ZVdVeW5zaWg3T1VYZjVnczVqMFkweTB1WVlGbExsYnRxMFJ0RmF2UXRJNnh3WHhVMHdPazRUdFAyWk8tTkdES0FQRWJXYWZjdWExZ202YXRqTTg4d1RiNVNCUnVUeGVWS3JkQ01XOVBhT2V6el91U2RVQkpkdWc3N0Jpc3ZKU3ZR?oc=5,"Mon, 01 Jun 2026 16:55:40 GMT",1.5,AI platform,Liatrio helps enterprises move from AI pilots to production-scale AI. Offer an AI Strategy Session.
10,Halliburton,7.0,Enterprise AI,Halliburton enhances seismic workflow creation with Amazon Bedrock and Generative AI - Amazon Web Services (AWS),Amazon Web Services (AWS),https://news.google.com/rss/articles/CBMiywFBVV95cUxQa2ZLcGZLdXdZVDFPWjFoQXd1enc3RWZONHhnSVpuRHJXMkhuMk9MU21rUmpqR0hzUlk0SE9KdllZc3daXy1ERHZTd0lKdDZ2ZmJ1ckVVWThaRDgwX1E1RGNNQVJja0YwSXdUYzFhbVBRbEUxc1NMeDFnaTNpNnI0TGlDOEJ2WVpYR2JoMkJkTmxZYlR6WDI0dzBVVDVEZDRVaURKQk5KMXcwcEM3RDJvbnZ2UWlLNV9DU2YzVmNla3piaGNNMDVKb3RIOA?oc=5,"Fri, 08 May 2026 07:00:00 GMT",1,generative AI,Liatrio helps enterprises move from AI pilots to production-scale AI. Offer an AI Strategy Session.
10,Halliburton,7.0,Security & Compliance,Could ‘zero trust’ have prevented the Halliburton cyberattack? - Digital Journal,Digital Journal,https://news.google.com/rss/articles/CBMioAFBVV95cUxNd3JEWUVKQjlJc19XZnI5US1qRFAyRk1CY0JOXzBhcTVKY0xXT1U3TGZyV1hGT3pWR0lOWlUzd0x6XzF4Z1RUWEtFSGhpaDRla0JkU1l0c2pzSy1iYjVKeFJnSFJHSExad0t0ZkduYmpDT09Vdnc0TWkyNGZlYWNaZEdXOVcwYmJnbEJPRnppaWVZcnIyNnNtXzJQTWt6X0tI?oc=5,"Thu, 22 Aug 2024 07:00:00 GMT",1,zero trust,Liatrio integrates security into the software delivery pipeline. Offer a DevSecOps assessment.
10,Halliburton,7.0,Digital Transformation,Pampa Energía Selects Halliburton to Support Enterprise Digital Transformation - Yahoo Finance,Yahoo Finance,https://news.google.com/rss/articles/CBMipwFBVV95cUxOWHBjNkJtdmN4SnMzNFg4aER3SGRPZDVCWWN2N05MMEVuV1l1Z0FHUE9kQWJoQjRRTDFsUFZuLXg1YUowWDQ1WHNuSWZfNENuLS13aXdZWlQ4Nzk5YnJpcF9GdTgxQTczT2lLWktQdUFFcUJDX0x6dzdkUFRsRm9idG1PTVZlMUVXak0wcTZMVjA3c0JzdWZ0anhsNnd5WkNITUcyQ2dKQQ?oc=5,"Tue, 09 Jun 2026 12:00:00 GMT",1,digital transformation,"Liatrio drives holistic transformation across people, process, and technology. Reference the leadership change and offer a strategy session."
10,Halliburton,7.0,Strategic Signal,Halliburton Powers Pampa Energia's Vaca Muerta Digital Expansion - The Globe and Mail,The Globe and Mail,https://news.google.com/rss/articles/CBMi5AFBVV95cUxPbk8yazBDMlowY1lEYXg0LWVZMTlVSzRGWkZVbldyX0lQLTR4aC1IVlE2TVJ3QWdWdUlXVjd1OEpWMDNnTUMtQ1FCaENiVEd1dDM4MEFiWE9yd01VMjVtaTc3RjM3TWZwdXhaM05lcXo4ZXRsbnRuQ1hnSWF0b0FSZ0NQTFVKajhEREF3QlR6aDhXTnhfZm81bjZjZ0NWamxTX1BLR1ZDcFZfUVFhaE1ZZkk1Z0kyXzVXQ2NoYWxVWjJCaTlBNVp2Z1JPMDcwTXRFcVA0Z0Zub1pYcGk4T0ZobU1uVHE?oc=5,"Wed, 10 Jun 2026 15:34:00 GMT",1,expansion,Company is investing in technology. Position Liatrio as their transformation partner.
