company_rank,company,company_total_score,liatrio_service_area,headline,source,url,published,relevance_score,matched_keywords,outreach_angle
4,Honeywell,11,Security & Compliance,Cellebrite DI (CLBT) Is Up 20.4% After FedRAMP Win And AI Launch Momentum - Has The Bull Case Changed? - simplywall.st,simplywall.st,https://news.google.com/rss/articles/CBMizAFBVV95cUxOMGpfaHMtTkhGR0RCZ2F1SThTYVk5aDZ3RGhvbV93Qk1EOGNCQTNQZ1h3ZW1ZamVoR2pTdlVka3I2d2gtVHJJOXozTjgtd0U1WGpqLTk1emNSTUJtVHdYZ2tEcEhRLWlwOTFyTVdDWmdHOFdUUFc5WlRwZm9nTklKT1hDdUZESUd2dDBOM2ZNcG82N2dXQ2xZTUE1TmNrYXRmY0VUMHVmOXBqdjNBcF9pSVcyZG9qelJzaU1jcDNJbVdOQU5udnRQbThmR2zSAdIBQVVfeXFMTjE0RjlFdjRPcDhLRFNSLVlha3J2V0lYbUl0NUFiUzU3V29GWFkzY3AwbzlRNDVkZFJhQjY1NnI5TEdOWTYzd3BsUEhvMnFYWkJwV29LbGEyMGt3akxxWG5McWxibjlXbW1FcTZMOVNSRG5RSTcxLWlkQVpOd2lVOXRxZkF4Q0t1MlpyS2daMTNuSTNTQ2N4M3ZFeEZ3YzNIdE4ycXFpVzlwWE9lQjkyOGloUkNCdnhXajgxSVRZZGNhSTJ2NXNXVUh3elhwOHN6VXpn?oc=5,"Mon, 01 Jun 2026 07:00:00 GMT",1,FedRAMP,Liatrio integrates security into the software delivery pipeline. Offer a DevSecOps assessment.
4,Honeywell,11,Security & Compliance,"Assessing Datadog (DDOG) Valuation After AI Growth, Strong Q1 Results And FedRAMP High Certification - simplywall.st",simplywall.st,https://news.google.com/rss/articles/CBMixAFBVV95cUxOcUVScmpZR203Y3dVSnJiV1RkUHc0WndoYzVCd0pfMV84UUxnaVlvTUdmckhTaEVqQ1FSbjNTcXV5UmVYOEpPaVVFbU1xMFhDMFh1cHNRbjEwaDZJRnI0Rk1aWk03NTd0c2Q1ZnpwUmNqREdCTWVzaE9CMktoeEFjejZUd3dGRGFWYlJ0QWZSaTVrRjlfb3JpTHdBaU5GTFlIVy0tRm5aZml6YnpQMnFLdnRBOUdCc0wwNllCbWl2dWRMTXJ10gHKAUFVX3lxTFBZWV9mQlNUd1Fua040MHdnVEdoQ01SMDRTMTNWb3RRdk1zMlZJbzNyWERPdVpPZjRGSlFZYWRLUmUyTTI0X2xBa1BqcTlJRHBaVktJbVFpSW1jdkRQQ0RKLWhwQ1RHNmxZd0xTY1JycE5fdHN5Tm01TWdDRl9IMWpBOWVkV3dHSFhBS2ZhVVZpei1DSzNkaHhTXzljUHYxQkVLVXJsSnBwZEJzU0dfVlZSQW1qMS1BQ1NXN2hSLTVuWTZHaXQ4ZEpNWGc?oc=5,"Tue, 02 Jun 2026 04:38:57 GMT",1,FedRAMP,Liatrio integrates security into the software delivery pipeline. Offer a DevSecOps assessment.
4,Honeywell,11,Digital Transformation,Honeywell prioritises pragmatism in digital transformation - Mobile World Live,Mobile World Live,https://news.google.com/rss/articles/CBMiogFBVV95cUxQVnBhaHBNN0R3ZzZMZlJINHNZSWttQ3RPbUtjVTBXMG9DbWhxczhGal9vRFpWVVJQMWtDbzkzdjY3NG0xZTBDaXp2QVJYOGFnQTB2ek81b2djRjdMYU5jWERGcjVuQ3U3cHdIazYyVzlXS0taUWw5djJ1V3NzVXhYVFo3TC1Qc051dWhYRkdSMTJLSy1NdXViRUVTU2lxM19vaVE?oc=5,"Thu, 18 Sep 2025 07:00:00 GMT",1,digital transformation,"Liatrio drives holistic transformation across people, process, and technology. Reference the leadership change and offer a strategy session."
4,Honeywell,11,Digital Transformation,NEW HONEYWELL FORGE AI-ENABLED SOFTWARE SOLUTION TO ACCELERATE DIGITAL TRANSFORMATION AND MODERNIZATION OF UTILITY GRID ASSETS - PR Newswire,PR Newswire,https://news.google.com/rss/articles/CBMijwJBVV95cUxQUXZlWkZsdUVfc3FXQklDYXV3RFQ1QkU1ZVhTX0xCdk1lZHd0a3lsTHFjdGI4enZyN1FxX1duUnc2R2x3X2g2NGJfYUdKbUpOYmV5OHg4dGltU0xqSXQtNzRkM0tpVTNlY01vMEZCSU9UaEFNNktwR1g4UEp1TmsxeU1KUTVnRTJPSHdTUXFhbjNXM1dQYUtaalB5cGU0bkg4RTFaQ0ZHTVJCendJT2lkUkRMTHNuZDhYVkFyV2pBdDhCMHN0amFqSk13UEpsa0hoMlJMVlVJNm5keE43SWxicDBmNmN2ZHgxLU5WTGd6eTlxWF85ZlcyZmlNTjc2N2ZuNGxfUHZKSEo1UERmV3JB?oc=5,"Wed, 29 May 2024 07:00:00 GMT",1,digital transformation,"Liatrio drives holistic transformation across people, process, and technology. Reference the leadership change and offer a strategy session."
4,Honeywell,11,Digital Transformation,A look at Honeywell's digital transformation strategy - TechTarget,TechTarget,https://news.google.com/rss/articles/CBMitwFBVV95cUxQc0lXdEVuOURPaFRVVG10OThhSjNXNS1aN3dZajNvRWRRYmNQSFNLZ2g5VmFueF9BTGRxV2doZUNGcFo3MjRfdWxIVXdiSjI5Q1dIc2JkYkVXOG04MV9BVkM4MkxJNHpsdm9QOWFUc0JLRVk3X3YyekszckZKZzVMcXAtUl9iUnlEcE9Ed1pQRGk4TmpqYUdERXlFOV9mWmQ1eXpQQlExeGdicWJGSkNCVDdGb2FSRnM?oc=5,"Fri, 03 Dec 2021 08:00:00 GMT",1,digital transformation,"Liatrio drives holistic transformation across people, process, and technology. Reference the leadership change and offer a strategy session."
4,Honeywell,11,Workforce Enablement,Opsera Named a Leader in the 2026 Gartner® Magic Quadrant™ for Developer Productivity Insight Platforms - PR Newswire,PR Newswire,https://news.google.com/rss/articles/CBMi7gFBVV95cUxOZ05od3hXMVpFS0paTzFpWE8wUENCVFc4VjloRHMyVmM0aWVZZjN5M3NUX0NLNjk2eGwwWFlJS2tfblVxaFJ4Z2tYaUYxSnh2MlQtN1FpcWVRc2dNTlVZTFVRWTJrazFmWkNkWTROa2g5eW5ja0stQTVkTkcwQ1BUUU5tY2czNXBfeHdJaUlsR2RlRWk3UDJlQm9jNHY5c01DR2pUYVdhTVpicHZwUDh6a0d3M2sxMnJSWWVVQlp6RTdfamJyVG10TUlkQUlJNnVSVDBQUklkeEJKd0tzbF9iOVlta0tVTTY1Sms1QXd3?oc=5,"Wed, 13 May 2026 07:00:00 GMT",1,developer productivity,Liatrio coaches engineering teams to become high-performing. Offer a team enablement workshop.
4,Honeywell,11,Workforce Enablement,"StarCRM moves from AWS to OCI, scales new markets, while improving developer productivity by 40% - Oracle Blogs",Oracle Blogs,https://news.google.com/rss/articles/CBMi1gFBVV95cUxNaEpHbmx1MGw2Zl9PZUpWbHQ0UXhrbXdLLWdZWnhrZ3kxVHBTd09oTGlLUXlpX1hrYkJaMWxKWXJROWQtcFgtbWhDRHByejlnR0FZWU93cW5HQ0pXajE3dVlDeTJYWHM0bTA3NzRudDVWc1MwSFlncmJJZFRMQkFMdHlYMzE1Si1ucmZ1bjh0bkdRbzR6eFdkZjNpcU9TWk9BQ1hpdmJGUThDdWdpbDBjUUg1aDJpSFd1dGE3SGlLcHhMNWx4OEJPS193VTJsbkdhbU5zQ3VR?oc=5,"Tue, 31 May 2022 07:00:00 GMT",1,developer productivity,Liatrio coaches engineering teams to become high-performing. Offer a team enablement workshop.
5,Rockwell Automation,10.5,Enterprise AI,Rockwell Automation Announces New Research Showing UK manufacturers Shift from AI Adoption to Industrial Execution - Yahoo Finance,Yahoo Finance,https://news.google.com/rss/articles/CBMitgFBVV95cUxNZzlBd2RkOXlrMVlBekJobkFBYlpneF9mQ21tV1N4eDQ2MTR3WVBDVjFMb3VicjM2ZHFIbXNNU0hESVd0amJGcFEzeExYTzdUSFZYXy15TXUxdGRmV1dJaWM3UnNlQTU5WlNTRER1cEVqSkJMelR3czQzZGR3QTVwU0FpMHVBaFM4RFBjVHZfRW40S2NtQjRJZHdCT0lzZ29BUXVMOUIzZkVlS1pUSWVsYkZIMEZQQQ?oc=5,"Tue, 19 May 2026 07:00:00 GMT",1.5,AI adoption,Liatrio helps enterprises move from AI pilots to production-scale AI. Offer an AI Strategy Session.
5,Rockwell Automation,10.5,Enterprise AI,ROCKWELL AUTOMATION TO ADVANCE INDUSTRIAL INTELLIGENCE THROUGH EDGE-BASED GENERATIVE AI WITH NVIDIA NEMOTRON - PR Newswire,PR Newswire,https://news.google.com/rss/articles/CBMi9wFBVV95cUxQWUlYUEJ6Ql94MzAyMDdDQW5BMnVaY1VVbXpyTFhadzlTYXVCRHZNOXhxbllDSFE3NEdkcDg4VUw4WUhkVVZMeW5DM0lkS3pCcVRURy1QX0RQa1RZTkI1clNKbG1BX1VNZDIxVGRwNVB3em5EcHFnLWR2YWlGSVJzeWVsd1hQSVlZZGUwelBSMzViZm1FLWRPenpPMmtBaHFyX1JjM29UTnhmSHVqaFVIMU1yWEpYM3A4eEFNcUVfS2xjVUVlM3FSU0pUSnJVU0hYUTQwd2NmUExZaDQ5X3lHQU5Ub2g1bFRDNXpQbks1MVZxT01Fd2dJ?oc=5,"Thu, 13 Nov 2025 08:00:00 GMT",1.5,generative AI,Liatrio helps enterprises move from AI pilots to production-scale AI. Offer an AI Strategy Session.
5,Rockwell Automation,10.5,Enterprise AI,Top 10 Companies Using Generative AI in Smart Manufacturing Innovation - Fortune Business Insights,Fortune Business Insights,https://news.google.com/rss/articles/CBMirwFBVV95cUxPdVdoMlVITERaVURZY1o1VEh2dVpnbWlLaV8wbWFqVlVkSDVrNG1LUkVtaTZjNjFDb1JlR1NKLXRzY0VUVHFwSGNjS1E0WThjVDltREI5SV96dlFBQnQ2UUs4MDBQQ1h4dGRjYVdNc01Vc3h3djBOUGJPSUluemIwQ3ZTU21DcUdyTkhBVWdlTUVHSGtIdzVWT3FBamx3V1FhLVo3OFZ1ZVRCM2c0SEdR?oc=5,"Tue, 02 Jun 2026 06:16:38 GMT",1.5,generative AI,Liatrio helps enterprises move from AI pilots to production-scale AI. Offer an AI Strategy Session.
5,Rockwell Automation,10.5,Enterprise AI,Rockwell Automation Announces New Research Showing UK manufacturers Shift from AI Adoption to Industrial Execution - Process and Control Today,Process and Control Today,https://news.google.com/rss/articles/CBMi2wFBVV95cUxOeUVVX1ozd3JJQ3BUTDdIcVJLZkRqNlo4V0NaLWR2dV9EWDEwd0hrVUhvUWNiRmlTQW45LTgtRGxOVFFOb0pjSVV6ZVF1X1h2dUpZQ2IwRGxsLWVZTnh4NHMtU0tkLXFKdHQtcmhObllpS0s5amFPU01uN3V5Z3lVNWxKcVZxNTJqdzNQbUp6dzZxcTVvV184ZThhVm9CUjl5SldJdmFFcjlDTFBzdGh4Wno5aWgyZjQwX25OM0RKbXRYNWc2SDVQVUpfUjRqdUhPZ1ZLNzZBYUtvQU0?oc=5,"Thu, 21 May 2026 04:00:50 GMT",1.5,AI adoption,Liatrio helps enterprises move from AI pilots to production-scale AI. Offer an AI Strategy Session.
5,Rockwell Automation,10.5,Security & Compliance,Manufacturing Undergoes Security Revolution as Zero Trust Replaces Perimeter Defense - Design News,Design News,https://news.google.com/rss/articles/CBMivwFBVV95cUxNYXkyWXlhQXAydHh4aVBnZXhkemFPY1FRdkNoUTI1Y3ZBY3NLVlZZLWJVSXhmemxUZ2Q3ZWJ1bXZaMXEzcF9XM0RlaExvQmd5TWE1bnRLX3JjOFBza1Uwajgtcm9pQUt6cndKb1ZvWGlEUVN4TjluZkRnZnNJNS1MT0dtaW4yMDVLbGpUTlc2bGtoV19DSTBpc3JRM19tRndmazBSbFgtN013cVloVU9aR3hUY1BEQ0o1bkFUaW1waw?oc=5,"Thu, 30 Oct 2025 07:00:00 GMT",1.5,zero trust,Liatrio integrates security into the software delivery pipeline. Offer a DevSecOps assessment.
5,Rockwell Automation,10.5,Application Modernization,Rockwell Automation goes cloud-native on Azure to bring modern software development paradigms to the factory floor - Microsoft,Microsoft,https://news.google.com/rss/articles/CBMiuAFBVV95cUxNenRQR1RCcVZmOGJRN0RicXR4dEJnb0JoZGxDd1drQXlxbVlXZVlDRURBbU9CUjBSQ1lTSTExaEpJQ1hHbEVCVFd5cVRjVjAwbmtuWXBvYmFUcjN6UHMwOU9iRDh5Q255SUpnWkx0SlBlQ1poUmo2ZXlvMkdBa1pOVm5kSzhHU3k4aGw0UlJhZEdWSmNSRjBhTm5Ic2lCVFRVVDVLcEhYVi1mdlh1TGJIUTRIN0ZfSllG?oc=5,"Mon, 02 Oct 2023 07:00:00 GMT",1,cloud-native,"Liatrio turns legacy apps into cloud-native, AI-ready software. Offer a modernization roadmap."
5,Rockwell Automation,10.5,Security & Compliance,WEBINAR: Modernizing Control Software - SDLC to DevSecOps for A&D - Aviation Week,Aviation Week,https://news.google.com/rss/articles/CBMinAFBVV95cUxOVFFlRlV6TllXbUlYS0YtZHRvaklsdlRTQmcyMVhjU2F0VTR0bWRJUkROeUQ0c3lmclNpM1BkbmFWRW9FQVBBMmc3YTBEczhCR0hPd0o4VmpGQkYxQUxKT2prWFZ0b2QzVm1zRmtfQWY0QzlTNkoxeTc1Q0R6NVhVTkREVFNLX0Y3R1gxVUlQRml3WW8xMHk0blduNWQ?oc=5,"Mon, 21 Jul 2025 07:00:00 GMT",1,DevSecOps,Liatrio integrates security into the software delivery pipeline. Offer a DevSecOps assessment.
5,Rockwell Automation,10.5,Digital Transformation,Rockwell Automation Supports Liquats Vegetals’ Digital Transformation of Plant Operations in Spain - Process and Control Today,Process and Control Today,https://news.google.com/rss/articles/CBMixAFBVV95cUxPQmdtSk52OHFfU1FMZDlqOXp5VjlKcGE5VHZpUnZKNklnTDFzMVZBbUVBdDBKRXM5NVJCcDBPODQ1NG9zdGZBeG1FTElVc3JLUmdXWjVzZlZUN25WSElFOUFwd2dOMGRKUV9sdGxmaTRhODY5N3dYdkpGQndLOTRkZWljaFRPUDVId2dELXB4alpsYmFmNXhVR05wZXhtOEpaTkxINUNjck5KcC1fVjFudVBIRkJTNk82bzRfeksyeGM0MmM4?oc=5,"Wed, 03 Jun 2026 04:04:02 GMT",1,digital transformation,"Liatrio drives holistic transformation across people, process, and technology. Reference the leadership change and offer a strategy session."
6,General Electric,10,Application Modernization,Accelerate Operations Technology Data Insights with GE’s Cloud-Native Proficy Historian - Amazon Web Services (AWS),Amazon Web Services (AWS),https://news.google.com/rss/articles/CBMiuwFBVV95cUxNUXU1MTFfbGJYTU51SVR2NGtfSWx3NDdteS1uOEdJODBoa2xuSkszaHJLLXBFUTZGSmM1NERCenNhNFB3NENqN2trNTN0QTdhM0hBRU1fNDlIWkhPRFBPQTFCcExyajdNQUpLNGd0Z2x0V1pzbnl4dW0zd0RoX0xHcXBSbFVrdmQ1N25hVF9MZ1UwRGp0MHZlQWdZWkt4NkVOajA3YkNmSEZhWndGeHpHQVlCcjRUUmoyNHZZ?oc=5,"Wed, 20 Sep 2023 07:00:00 GMT",1,cloud-native,"Liatrio turns legacy apps into cloud-native, AI-ready software. Offer a modernization roadmap."
6,General Electric,10,DevOps & Platform Engineering,Red Hat’s OpenShift 4 Kubernetes Platform: 5 Things To Know - crn.com,crn.com,https://news.google.com/rss/articles/CBMilgFBVV95cUxNam5mTFBIcDl4bzlicGhETUVxdWdVNFIxeXJYVnBsX2lyV1kzbG9MWmNacHlPMjRMUWVyYW40S3lUME5QeFdPUDk0ZS1iQXZiSm9RQzhKZnVKN3o0b1NSbGdTUzIyRTZad2hnZHpJWEVveW9OQWwxOHl6bFY5czJqd1ZtZGlCVG14R3hGNFZmR082R3dNT3c?oc=5,"Fri, 10 May 2019 07:00:00 GMT",1,Kubernetes,Liatrio builds internal developer platforms that accelerate delivery. Offer a DevOps maturity assessment.
6,General Electric,10,DevOps & Platform Engineering,How the British Medical Journal ditched its old culture for a DevOps environment - Cloud Computing News,Cloud Computing News,https://news.google.com/rss/articles/CBMisgFBVV95cUxOclhCRU82LV9kQ3g3cWJ4NERITFl1eWlSVGo1c19YZEJ1ZjJoN2plZ1E4Zy1YUGRVakFUbXRtek5NZzlQS3otcllNcTBkWlQ2b19WUTJBc3NrQm93aXVCNjFuY3ZiZU9Rek5vMHVZX29GUU5ZV3NObnJuQ0FQZlFqVnpXM2xWUG1aamoxWFhxS3ByakJSd1RrOThQQmdUUjVhbXUtQmdNU2RIeXNxMU0wdFFn?oc=5,"Fri, 19 Jul 2024 09:56:54 GMT",1,DevOps,Liatrio builds internal developer platforms that accelerate delivery. Offer a DevOps maturity assessment.
6,General Electric,10,DevOps & Platform Engineering,Pure Storage Expands Kubernetes Data Platform to as-a-Service Offering - Enterprise Storage Forum,Enterprise Storage Forum,https://news.google.com/rss/articles/CBMieEFVX3lxTE5RN085dUVod1VSVDhwVmdjOEdfR21zeUg4em1qZ2NsOFdoTWgzYVhvYkU1LUpKWFdtcVU2SXBMSkVONFpBZVdHZjJMVlFZai1HTklEai0xOEduRU4ta2JWVkJRMmVEcG5Wa1hvU0xOM3ZIWlJZelc5Qg?oc=5,"Fri, 11 Nov 2022 08:00:00 GMT",1,Kubernetes,Liatrio builds internal developer platforms that accelerate delivery. Offer a DevOps maturity assessment.
6,General Electric,10,Application Modernization,J.P. Morgan Rushes To Modernize As Cloud-Native Competitors Move In On Its Payments Business - Forbes,Forbes,https://news.google.com/rss/articles/CBMi2gFBVV95cUxQYTBZem41bmM1VkZqeGVzTHNPS0ZHbWxnT0F4Yks1eEVDdGl0T0d5YjBEYTZ1Y20yQ2hrZFdJcXM5S0NlbjNzQlJvdXRUakJGNkxXTVkySDhKajdqV0dlaVdoV3FpbEp4dTl4eWt6NmxILWtrTmp4aUd3UFUzblp3RUw2aWdVdjNWbzNKOEdDc0RTZmhvS3V4amhiNERtZWlpX2R2QVpzekp0NXlQWk5DbnVORHdHY0FLNnFPM211TUhUMFRfRzl3WHZobHI4WHNKT0Rxa0dZNEkxZw?oc=5,"Wed, 14 Sep 2022 07:00:00 GMT",1,cloud-native,"Liatrio turns legacy apps into cloud-native, AI-ready software. Offer a modernization roadmap."
6,General Electric,10,Security & Compliance,Zscaler Appoints Sunil Frida as Chief Marketing Officer to Accelerate Growth in Zero Trust and AI Security Market - Quiver Quantitative,Quiver Quantitative,https://news.google.com/rss/articles/CBMi3wFBVV95cUxQSmlNZlZqOU45Z1RlR2x5a09QbXc2STZJcWRIbGhlZUVvUVZsaUtjZllTYVNlNUdJc2VwQ2ZLQjhjU293ZkV3SEdsYUx1ZEUwVDUzazIxMmJYaEtJRDYxaDlkaEdTaWVzdDhuSDZldUdPSkVsZXdmVGplLW1KWVVHTzJuVjQtYUdZRUVseVBzQmlCNFJ2YTJRWUdkQVc4UEdqcGRubkpKZ01yR2pLeFZkVTEtQnZPRjJhcVVHb3l6dHVHNlo2NDBtNVRSN3diNV9zYS00cTE5WFl6anNQNmdj?oc=5,"Mon, 05 Jan 2026 08:00:00 GMT",1,zero trust,Liatrio integrates security into the software delivery pipeline. Offer a DevSecOps assessment.
6,General Electric,10,Digital Transformation,GE leads digital transformation of Kuwait Ministry of Electricity & Water's Sabiya CCGT Power Station - General Electric,General Electric,https://news.google.com/rss/articles/CBMiwAFBVV95cUxQX0dxZi0xR3F5T0tXclBhRkRGT3ZYRjZBbzNqYWV5dFlscnZsMTRsT0tUYzl1Zmt6M1FTQW5uQ0lpdVVYWmhmSXQ3U2hzcFlFc3g1YTJYVnVjRGVQU2txSGoxa2t6N21WN3FwaENLZGtLWEdIR2NuZnJaWHRCdUZvbnlhWUdkcVhvZ1RPVXJvTzQ1UFM5MTNzMV9iYWZfazRZaWpCczkyQ1lrVk1oRDBDTEZEeU1Ka0daRHZ6Unl5dGc?oc=5,"Wed, 05 Jul 2017 07:00:00 GMT",1,digital transformation,"Liatrio drives holistic transformation across people, process, and technology. Reference the leadership change and offer a strategy session."
6,General Electric,10,Digital Transformation,Digital Transformation At Scale At General Electric: Digital Influencer Bill Ruh - Forbes,Forbes,https://news.google.com/rss/articles/CBMi0AFBVV95cUxPaHNiRzFQNFBwaFZ0bHpFSzE1R21Ydm5VQjdZTWctSzhuWWgxU240LU80cktXZ0J0U19qbHp3LWlOUkEybm1aY2o5Y3RVcGVGLTBlM2o0U3k3YWZWdFgtRFZPM3R4RW1LOFpFaUtnSndsT0QyOGdKYkl6azh1U0txRWliU09EZzZhYjliNnBhTnExSHNUV3p1bk9sQkZpRDZ0c0Vxd1FCTk96MGhzMlM4MGhrOGVZd0l3N2ZSQTF1U2J3cUVOR3FibXM4S3Ftb1Vi?oc=5,"Mon, 25 Jul 2016 07:00:00 GMT",1,digital transformation,"Liatrio drives holistic transformation across people, process, and technology. Reference the leadership change and offer a strategy session."
6,General Electric,10,Digital Transformation,General Electric – Digital Transformation Strategies - Global Data,Global Data,https://news.google.com/rss/articles/CBMiigFBVV95cUxQb1hyZXl0a0FPNlo3T3ZJcG1jV2NMdWlGczBYekUxRHpJMVZLaDdNVzRlTDRTNVZoemdXcEdmVjJzZHQtbUhzeGRIakpKejJEdmo3Z1ItQmd5ZW11R1dia2FsY1oyUmE2aVhpUVF3YTdCZ0x2dFBWb2w3b2NUNTNvZkZmUVNmWFZsdFE?oc=5,"Tue, 29 Oct 2024 07:00:00 GMT",1,digital transformation,"Liatrio drives holistic transformation across people, process, and technology. Reference the leadership change and offer a strategy session."
6,General Electric,10,Digital Transformation,Lessons learned from GE's Digital Transformation Failure - Intelligent Automation Network,Intelligent Automation Network,https://news.google.com/rss/articles/CBMiuAFBVV95cUxPRVBidzlIUnhZWWdzRTBRRS1kbVQzQWhMb3EwTDZLVmZQVEYwdEhEUkg3NTRuTGIxUUExWVhHcWY4cGtyUXQ5X0xycm9TbWhoY3VlcUtOd3d5Qml0WE11bjByZzdMM0JaNEZmODF6QmJad21HeGUzT0ppaEhSYjUweW1wN1VNRGhwSmE2bmRxalF1bHZGQkdzQWhpRmNPMWVLUGNVaGdIWHlhZnhYaFRBVnBtbTBsNkFv?oc=5,"Tue, 08 Mar 2022 08:00:00 GMT",1,digital transformation,"Liatrio drives holistic transformation across people, process, and technology. Reference the leadership change and offer a strategy session."
7,General Dynamics,9.5,Enterprise AI,"General Dynamics’ AI Strategy: Analysis of Dominance in Aerospace, Defense AI - Klover.ai",Klover.ai,https://news.google.com/rss/articles/CBMingFBVV95cUxOT0c5NXZsaDFxbURBdmRIZnAzX0tLOEpsX1pQWlpkRHYyZFFUTndUTEJwNmlGOU1wY2p1WkZ6ckJaS09kMzYwNjVOQUxQeHZFWUhaUHBxb1Y2VTM1MzcyajJTSG9FTHJJODY2Z29QZktRNzBLV0hFVDhOYng3NWtLaHhSS2tGRE9BTjJtQ2k2X0ZJcERxOWwxUEp6QkZFQQ?oc=5,"Thu, 31 Jul 2025 07:00:00 GMT",1.5,AI strategy,Liatrio helps enterprises move from AI pilots to production-scale AI. Offer an AI Strategy Session.
7,General Dynamics,9.5,Security & Compliance,GDIT secures $120 million task order to deliver zero trust for global US Air Force bases - Industrial Cyber,Industrial Cyber,https://news.google.com/rss/articles/CBMivAFBVV95cUxNVmk5dDhNU20tbTdZVWp1b3VCck1iY1hNMmFpd1FVMVh3LUtIZGg0NWV0dGExMmVJZ0xtNERnR1QzTkZGakt1SjZibE5HQ2x1aEkxcjJuVnRwdms3aUZKS1ZMV3VJeXJOUkhXX1NOWi10VzhDQ0xsdlRaM0JpWnhHR05yNkFYVWw5aUNuVm45N0EwQkRyTmtUUTBiRjdwdGFjV1pzcEVzQ29uMTNDRXBIRkt3QXIxcHBGZUlSNg?oc=5,"Thu, 15 Jan 2026 08:00:00 GMT",1.5,zero trust,Liatrio integrates security into the software delivery pipeline. Offer a DevSecOps assessment.
7,General Dynamics,9.5,Digital Transformation,CACI Wins $416M US Navy IT Modernization Contract - The Defense Post,The Defense Post,https://news.google.com/rss/articles/CBMibEFVX3lxTE1TZXUybDMtNzJSVk9KcDcxOEoxMGVVSExaV3NkekZYaml3NUVUTTVwaHZMVk1pVzEtMGtPeUtlMWNod1FmNEl1S01ON2JmbVRFN2dwdTV5eF84T0t6b2ZhaXZ6NEFzdUhRSDF4cNIBckFVX3lxTFBsa3UzZWd4VVV3bnZzMHBKd2xkc0p6VGpheHhCQU9UY1dteXAzQW0yYV9mS1JGS084V3ZfVC02VXE0WldyNGtJS29Ldm5FbVF1M2lFTEdoWjlPSzNNTnV1T2Q4LWRQal9EeTN6ZktLUS01Zw?oc=5,"Wed, 14 Jan 2026 08:00:00 GMT",1.5,IT modernization,"Liatrio drives holistic transformation across people, process, and technology. Reference the leadership change and offer a strategy session."
7,General Dynamics,9.5,Cloud Migration,General Dynamics IT takes multicloud strategy to the next level - cio.com,cio.com,https://news.google.com/rss/articles/CBMipgFBVV95cUxPd1ZBR3p2VmpRc0ZQSmZldzQwbGxITEtuZm5jZUdOdzZoZGZTNENXYXJ6TzFpNDdSUHZEVEM1NDRKR0dnVWQ1TXI5S0xrbGdrNHV3NGJHcjkzWEI0TGw2bDNRdGFKNUt4clpZM3lnUktZd3JLWGg1OEhlVlpDd3UxTTVUWHlqeGwwVW12YVdSb1loQ3MxaktkWTFORmFQWW5NcldDSE9R?oc=5,"Fri, 12 May 2023 07:00:00 GMT",1,cloud strategy,Liatrio designs AI-ready cloud platforms. Offer a cloud migration assessment.
7,General Dynamics,9.5,Security & Compliance,General Dynamics IT books $120M Air Force zero trust contract - Washington Technology,Washington Technology,https://news.google.com/rss/articles/CBMiwAFBVV95cUxNWnNQdVhNaFhRalN1XzR2bGY4bGdQM25fNkh0NmJTV2VEMm1MOGhkQS1OTHpHMEdxUXhPbjlWbDU3c1hOWmVGVmhJZFZOZDBNU2RTaUxTQl85bFFDZ0ttYTc4Y2R3YzVKTFN5NEZFeUZkQS1ib2xTajQxQ1ItbU5Fd2tZVWxHOExTQzRwTnBPY3hORVdyR2U4Um9uQjI3QTZrMU1HSTYydWZKZUJtcmV1RzI2QUFwMnFsbWgxaU0yNk8?oc=5,"Thu, 15 Jan 2026 08:00:00 GMT",1,zero trust,Liatrio integrates security into the software delivery pipeline. Offer a DevSecOps assessment.
7,General Dynamics,9.5,Security & Compliance,GDIT Books $120M Air Force Task Order for Zero Trust Delivery - GovCon Wire,GovCon Wire,https://news.google.com/rss/articles/CBMigwFBVV95cUxNR2lsTkctNXFyNFNXakhrZG1iX3Y0aVNtUmZOeUtDV2xYS0RvS2lhXzcxUUR5Qjhfdl9sZmVWbFgzX0o1UG8xSlRCUWZ6MmYzQ2kyLUZtaVIwdnBKWXFPVjFtcW1YcjlLWHlqMzlEN1RKdjZLZkhXVXVkX2hfd2U3ZTdjaw?oc=5,"Thu, 15 Jan 2026 08:00:00 GMT",1,zero trust,Liatrio integrates security into the software delivery pipeline. Offer a DevSecOps assessment.
7,General Dynamics,9.5,Security & Compliance,USAF selects GDIT for zero trust cybersecurity implementation - Airforce Technology,Airforce Technology,https://news.google.com/rss/articles/CBMib0FVX3lxTE0tU2pzeU1tVmpCRjEzNlIzVmFfQUdqWnE4czdCSWoweVZQdTJpMG5TV0lLMnlhMTRfZUM0TjdiTC1PVjlWUmRwSDlMX2VMU25oLTdfczdsUTF5RE1nVFJaekN4T2V0bHV4QUhfN21MYw?oc=5,"Fri, 16 Jan 2026 08:00:00 GMT",1,zero trust,Liatrio integrates security into the software delivery pipeline. Offer a DevSecOps assessment.
7,General Dynamics,9.5,Digital Transformation,GDIT Awarded $1.5 Billion Enterprise IT Modernization Contract to Strengthen U.S. Strategic Command's Operational Readiness - PR Newswire,PR Newswire,https://news.google.com/rss/articles/CBMihgJBVV95cUxQdk9INFpNRWpLdFpXQjRSb3BDUk51MkJSOUJRdFpIQlVPckZBaWlHTHFKT0ZiU3NZcjNTWVpSVWxpcjZyS1pLajE4Y2kxQ0tBVmNsdVdJemlTQWVGS2t1T0pyYUZXNDFBUkhfTW5paEVyZmRKRTJIOTZmWDhfNnAzeGJvYVpfMzZCcmh4eGFnYnBtNVNlbDV2bUR4ZHZldTB5WWVCNlBGR0U4UkZnRmcyUUt2X0FpZEpuaEJFVVBMdUNYOXQ1SUN0bjlqbE81LXlkZ0xZU1luUXJpUG4teDg1czc3R012cGhQZGVDcmlsYUNqWnFfSjBOQzY5bGhkNzV4SkE3Q21n?oc=5,"Thu, 25 Sep 2025 07:00:00 GMT",1,IT modernization,"Liatrio drives holistic transformation across people, process, and technology. Reference the leadership change and offer a strategy session."
8,Johnson Controls,9,Enterprise AI,Johnson Controls International’s AI Strategy: Analysis of JCI’s Dominance in Smart Building Technology AI - Klover.ai,Klover.ai,https://news.google.com/rss/articles/CBMiwAFBVV95cUxPc2Z0eDRxd2F0ZElLMWpIX1FsOFNfM3h6dUo1M2NadU9mb2dyLWR5YUhEc0hCNjhmbzlmX3NUNjdCNkhwbGRmUjRiZzBJTWUzX1R5Qk92TVpvWFF6a2tVdDNqUVROOVZ6VjNveXBOUThXRktfUWlnSnJUaDU0QTBNWk9oZWxBNGNTejNVUXQ4NnRMTm8tVHNha09PaTd6VGdkcHNyQ2cwSGxxUjlBODB6YUxXcjRHai01S0ZsYWhuQUo?oc=5,"Mon, 04 Aug 2025 07:00:00 GMT",1,AI strategy,Liatrio helps enterprises move from AI pilots to production-scale AI. Offer an AI Strategy Session.
8,Johnson Controls,9,Application Modernization,Johnson Controls rethinks IT for the cloud-native and AI era - cio.com,cio.com,https://news.google.com/rss/articles/CBMingFBVV95cUxOSndHSWRkWlEtcWdZWl9YbnVuYU5IRHlDYzg2aWZOWFBEZGZaQzBwR2pwdnNkQi1va2trTzVBYTJEd3YzakJPa09SX0VfLUN6X0N4enZvSXVZY2RJV1dnVEF5Nl9JUTZFX3hUUDRScnlDakwyNll5SmVMSmdJb0sycVlhVmhNN1RkOXhkZXBJVTliSjVxWWxBV0RwN2k5dw?oc=5,"Mon, 05 May 2025 07:00:00 GMT",1,cloud-native,"Liatrio turns legacy apps into cloud-native, AI-ready software. Offer a modernization roadmap."
8,Johnson Controls,9,Digital Transformation,"Johnson Controls – Deploying A ‘Business Operating System’ (BOS) To Realize The Full Potential Of Digital Transformation Across 19,000 Users - Infosys",Infosys,https://news.google.com/rss/articles/CBMilgFBVV95cUxQcVA0cTJmUFJBTE1ROWJNVU5NMnV2Rk9wbEo3ZXlpMzI5aU03ZGhobHZTQ3duWmw4Y2ZEWVpQNTl3S3NUTU54UEZmRVZ5cDZHZ0pRTTVFMlFiTDU0YXpxdlIxRGs5aUZ4OEUxVFQyeGxGc1NwdVlhVndjSC1lVFZoYVMta1BYdUI2cUN5MHRhQS1fSHhnMmc?oc=5,"Tue, 18 Oct 2022 00:42:39 GMT",1,digital transformation,"Liatrio drives holistic transformation across people, process, and technology. Reference the leadership change and offer a strategy session."
8,Johnson Controls,9,Cloud Migration,ROSA by Red Hat and AWS simplifies hybrid cloud modernization - SiliconANGLE,SiliconANGLE,https://news.google.com/rss/articles/CBMirAFBVV95cUxOeFlSbGdMX3NNSjllWkd4NG1DMld2N2tJTDY4OG94Z3VfZ0xEcE8xNEYxc1BGLWFpeGs2NEdOY2pMOE05V1o4Nk5PNnNEb2c1eEtsaDZuMVBQempDOXduRVoyeUdxSEpqN0l4aTZMM25KREJEalJ2akNTRHVlWTJVNXhuU2VvWHVfdnUwSmQ2RHVyd2huR0xKeDE3MmNqNm9NNkMtOGtHRDRfenRN?oc=5,"Tue, 27 May 2025 07:00:00 GMT",1,hybrid cloud,Liatrio designs AI-ready cloud platforms. Offer a cloud migration assessment.
8,Johnson Controls,9,Security & Compliance,How FedRAMP-Certified OpenBlue Optimizes Government Agency Workplaces - Johnson Controls,Johnson Controls,https://news.google.com/rss/articles/CBMi1AFBVV95cUxPNzNZR0trd1dscXl2VkVHODFNSXlxUk1jNndhRTBab0Vzb3hYRmluVHRCX2QwQ1IybmtpOXlkSzhVS3hfcjVfRUF3X2NrbWltLUNVYnBNQi1zU2R3T1VnR0VXb0trU25rODQxTWY4NDFpalpyc3lvNUlsR0RFRVRoVXJhdHozVlE2djFwNVdoWkJSV1hSRkpTRFBmN3pTUENPVVRhOS1VaFpwekxRT19Tc0NHY0lvaVRvdFllTWlSNUNFY1ZkZURpOG5QY3hEU1BjN3I1MQ?oc=5,"Thu, 25 Sep 2025 07:00:00 GMT",1,FedRAMP,Liatrio integrates security into the software delivery pipeline. Offer a DevSecOps assessment.
8,Johnson Controls,9,Security & Compliance,Johnson Controls acquires Tempered Networks to bring zero trust cybersecurity to connected buildings worldwide - Johnson Controls,Johnson Controls,https://news.google.com/rss/articles/CBMiuwFBVV95cUxOYWJrOUhoM0c2TU5ZeHFPcWphVlVDMXlqSXZCSTVKbW5yWEl2UnJGWml2UjBlckdLMTJ4UVRtNGFlUmtmRWRvTmFKR01zRk5wLTlyMXk1djZQNlFHcmExX0x5WG8zSVY4Y1dMU0J6LU5ocVYwM043OU85TzhHS3VaMW1IX1ItNm80ZWo0NlBtMkFHTzRRbkdySGp2aEIwak5PenpfZERwS1V5cEkxaVNXSnNKZHpUZFBKcU0w?oc=5,"Thu, 23 Jun 2022 07:00:00 GMT",1,zero trust,Liatrio integrates security into the software delivery pipeline. Offer a DevSecOps assessment.
8,Johnson Controls,9,Security & Compliance,Johnson Controls Acquires Tempered Networks to Bring Zero Trust Cybersecurity to Connected Buildings - Dark Reading,Dark Reading,https://news.google.com/rss/articles/CBMi6AFBVV95cUxPZjJCb3JmaWFmTjhQVE5lOXlCMGFQS3MwNUNvbmhVejA2bFBrLWRDcU41ZmZTSUJHbld0SG5BWTRTVnZWQjc1cDdaWl90eUEzQ0xEalFGRkJtdVc2UnZSd3NQbzh6YVBpakJMU2VaOUZNakZhUnc0eFp1UUJBYU9STW1DOXFUaV9oaWM5alpscTZmdW9Ienl0QzVNTmtPandES2ZvOFdCWGtDR2t3SjlWaDhibGIxclNEc2dOTlpmWWFTYXJpb2tHa3lNWXdoMjRXcy1pNnFrMEs2ZWZ4cWVzN2R6Z3ZCRVlu?oc=5,"Sat, 13 Apr 2024 01:09:51 GMT",1,zero trust,Liatrio integrates security into the software delivery pipeline. Offer a DevSecOps assessment.
